{
  "schema_version": "oi-discovery.manifest.v0.1",
  "query": {
    "source": "dandi",
    "dataset_id": "001603",
    "version": "draft",
    "formats": [
      "nwb"
    ],
    "modalities": [],
    "min_size_bytes": null,
    "max_size_bytes": null,
    "max_assets": 3,
    "require_public": true
  },
  "dataset": {
    "source": "dandi",
    "dataset_id": "001603",
    "version": "draft",
    "name": "001603",
    "status": null,
    "description": null,
    "license": null,
    "source_url": "https://api.dandiarchive.org/api/dandisets/001603/",
    "asset_count": 111,
    "total_size_bytes": 322237314228,
    "assets": [
      {
        "source": "dandi",
        "asset_id": "sub-HO2/sub-HO2_ses-20250916T190927_obj-1s1jcwl.nwb",
        "path": "sub-HO2/sub-HO2_ses-20250916T190927_obj-1s1jcwl.nwb",
        "size_bytes": 31479240,
        "format": "nwb",
        "modality": null,
        "license": null,
        "source_url": "https://api.dandiarchive.org/api/dandisets/001603/versions/draft/assets/sub-HO2/sub-HO2_ses-20250916T190927_obj-1s1jcwl.nwb/",
        "content_url": null,
        "checksum": null,
        "modified_at": "2025-09-19T21:32:09.675053Z",
        "raw_metadata": {
          "asset_id": "5bc6228b-aa94-4acf-9423-b5a260844ff3",
          "blob": "6cfb238d-dd77-4c91-a5c9-adc3707b00ac",
          "zarr": null,
          "path": "sub-HO2/sub-HO2_ses-20250916T190927_obj-1s1jcwl.nwb",
          "size": 31479240,
          "created": "2025-09-19T21:32:09.675030Z",
          "modified": "2025-09-19T21:32:09.675053Z"
        }
      },
      {
        "source": "dandi",
        "asset_id": "sub-HO2/sub-HO2_ses-20250916T190927_obj-vm83mt.nwb",
        "path": "sub-HO2/sub-HO2_ses-20250916T190927_obj-vm83mt.nwb",
        "size_bytes": 16490528,
        "format": "nwb",
        "modality": null,
        "license": null,
        "source_url": "https://api.dandiarchive.org/api/dandisets/001603/versions/draft/assets/sub-HO2/sub-HO2_ses-20250916T190927_obj-vm83mt.nwb/",
        "content_url": null,
        "checksum": null,
        "modified_at": "2025-09-19T21:32:12.229480Z",
        "raw_metadata": {
          "asset_id": "c320780a-8fdf-4b40-b71b-480c5a9817c3",
          "blob": "5711a7ef-1425-429b-9746-ecd69f1fdddb",
          "zarr": null,
          "path": "sub-HO2/sub-HO2_ses-20250916T190927_obj-vm83mt.nwb",
          "size": 16490528,
          "created": "2025-09-19T21:32:12.229447Z",
          "modified": "2025-09-19T21:32:12.229480Z"
        }
      },
      {
        "source": "dandi",
        "asset_id": "sub-HO2/sub-HO2_ses-20250916T190928_obj-86y47o.nwb",
        "path": "sub-HO2/sub-HO2_ses-20250916T190928_obj-86y47o.nwb",
        "size_bytes": 16484448,
        "format": "nwb",
        "modality": null,
        "license": null,
        "source_url": "https://api.dandiarchive.org/api/dandisets/001603/versions/draft/assets/sub-HO2/sub-HO2_ses-20250916T190928_obj-86y47o.nwb/",
        "content_url": null,
        "checksum": null,
        "modified_at": "2025-09-19T21:32:14.881842Z",
        "raw_metadata": {
          "asset_id": "4087162f-664b-4ecb-97e9-d20e75ee77db",
          "blob": "a3e3b8cd-12bb-474e-9665-3fae9625afc6",
          "zarr": null,
          "path": "sub-HO2/sub-HO2_ses-20250916T190928_obj-86y47o.nwb",
          "size": 16484448,
          "created": "2025-09-19T21:32:14.881820Z",
          "modified": "2025-09-19T21:32:14.881842Z"
        }
      },
      {
        "source": "dandi",
        "asset_id": "sub-HO2/sub-HO2_ses-20250916T190936.nwb",
        "path": "sub-HO2/sub-HO2_ses-20250916T190936.nwb",
        "size_bytes": 13616168,
        "format": "nwb",
        "modality": null,
        "license": null,
        "source_url": "https://api.dandiarchive.org/api/dandisets/001603/versions/draft/assets/sub-HO2/sub-HO2_ses-20250916T190936.nwb/",
        "content_url": null,
        "checksum": null,
        "modified_at": "2025-09-19T21:32:22.597402Z",
        "raw_metadata": {
          "asset_id": "1dbd10f8-3250-4b6d-b87f-dbb96dfc0f9a",
          "blob": "751d93f3-9821-4fdb-bbe6-719f6d0f150d",
          "zarr": null,
          "path": "sub-HO2/sub-HO2_ses-20250916T190936.nwb",
          "size": 13616168,
          "created": "2025-09-19T21:32:22.597381Z",
          "modified": "2025-09-19T21:32:22.597402Z"
        }
      },
      {
        "source": "dandi",
        "asset_id": "sub-HO2/sub-HO2_ses-20250912T144839_ecephys.nwb",
        "path": "sub-HO2/sub-HO2_ses-20250912T144839_ecephys.nwb",
        "size_bytes": 2288455836,
        "format": "nwb",
        "modality": null,
        "license": null,
        "source_url": "https://api.dandiarchive.org/api/dandisets/001603/versions/draft/assets/sub-HO2/sub-HO2_ses-20250912T144839_ecephys.nwb/",
        "content_url": null,
        "checksum": null,
        "modified_at": "2025-09-19T21:33:40.776396Z",
        "raw_metadata": {
          "asset_id": "6d8c4509-cec0-478b-b7f6-97edca835c9d",
          "blob": "c0e23e5f-cd20-4a76-b110-8afed7c8e449",
          "zarr": null,
          "path": "sub-HO2/sub-HO2_ses-20250912T144839_ecephys.nwb",
          "size": 2288455836,
          "created": "2025-09-19T21:33:40.776380Z",
          "modified": "2025-09-19T21:33:40.776396Z"
        }
      },
      {
        "source": "dandi",
        "asset_id": "sub-HO2/sub-HO2_ses-20250912T144835_obj-77d92a_ecephys.nwb",
        "path": "sub-HO2/sub-HO2_ses-20250912T144835_obj-77d92a_ecephys.nwb",
        "size_bytes": 2183760557,
        "format": "nwb",
        "modality": null,
        "license": null,
        "source_url": "https://api.dandiarchive.org/api/dandisets/001603/versions/draft/assets/sub-HO2/sub-HO2_ses-20250912T144835_obj-77d92a_ecephys.nwb/",
        "content_url": null,
        "checksum": null,
        "modified_at": "2025-09-19T21:33:41.505966Z",
        "raw_metadata": {
          "asset_id": "a30ddfeb-092b-4a82-9da5-0f5ddec4f015",
          "blob": "d2718586-0aee-4478-b1b4-5fd28fceea2d",
          "zarr": null,
          "path": "sub-HO2/sub-HO2_ses-20250912T144835_obj-77d92a_ecephys.nwb",
          "size": 2183760557,
          "created": "2025-09-19T21:33:41.505949Z",
          "modified": "2025-09-19T21:33:41.505966Z"
        }
      },
      {
        "source": "dandi",
        "asset_id": "sub-HO3/sub-HO3_ses-20250912T144835_obj-1hc8buj_ecephys.nwb",
        "path": "sub-HO3/sub-HO3_ses-20250912T144835_obj-1hc8buj_ecephys.nwb",
        "size_bytes": 2328294884,
        "format": "nwb",
        "modality": null,
        "license": null,
        "source_url": "https://api.dandiarchive.org/api/dandisets/001603/versions/draft/assets/sub-HO3/sub-HO3_ses-20250912T144835_obj-1hc8buj_ecephys.nwb/",
        "content_url": null,
        "checksum": null,
        "modified_at": "2025-09-19T21:33:49.993396Z",
        "raw_metadata": {
          "asset_id": "3d3a48bd-2b6d-4ace-aa09-d03634217028",
          "blob": "825c783c-14be-454b-b3f5-2e2cb6103a7c",
          "zarr": null,
          "path": "sub-HO3/sub-HO3_ses-20250912T144835_obj-1hc8buj_ecephys.nwb",
          "size": 2328294884,
          "created": "2025-09-19T21:33:49.993380Z",
          "modified": "2025-09-19T21:33:49.993396Z"
        }
      },
      {
        "source": "dandi",
        "asset_id": "sub-HO2/sub-HO2_ses-20250912T144835_obj-9jlzq1_ecephys.nwb",
        "path": "sub-HO2/sub-HO2_ses-20250912T144835_obj-9jlzq1_ecephys.nwb",
        "size_bytes": 2273144092,
        "format": "nwb",
        "modality": null,
        "license": null,
        "source_url": "https://api.dandiarchive.org/api/dandisets/001603/versions/draft/assets/sub-HO2/sub-HO2_ses-20250912T144835_obj-9jlzq1_ecephys.nwb/",
        "content_url": null,
        "checksum": null,
        "modified_at": "2025-09-19T21:33:55.013556Z",
        "raw_metadata": {
          "asset_id": "255a6181-af22-48e2-8609-0c28cbd98be3",
          "blob": "14a4d288-7eb1-4b6c-9272-e8a6e1a9e6eb",
          "zarr": null,
          "path": "sub-HO2/sub-HO2_ses-20250912T144835_obj-9jlzq1_ecephys.nwb",
          "size": 2273144092,
          "created": "2025-09-19T21:33:55.013536Z",
          "modified": "2025-09-19T21:33:55.013556Z"
        }
      },
      {
        "source": "dandi",
        "asset_id": "sub-HO2/sub-HO2_ses-20250912T144837_ecephys.nwb",
        "path": "sub-HO2/sub-HO2_ses-20250912T144837_ecephys.nwb",
        "size_bytes": 2188720285,
        "format": "nwb",
        "modality": null,
        "license": null,
        "source_url": "https://api.dandiarchive.org/api/dandisets/001603/versions/draft/assets/sub-HO2/sub-HO2_ses-20250912T144837_ecephys.nwb/",
        "content_url": null,
        "checksum": null,
        "modified_at": "2025-09-19T21:33:55.803978Z",
        "raw_metadata": {
          "asset_id": "0aefde2e-ebc8-456c-9932-bc4c1639e0c1",
          "blob": "db27c135-bb00-437f-829c-b8e071c20d10",
          "zarr": null,
          "path": "sub-HO2/sub-HO2_ses-20250912T144837_ecephys.nwb",
          "size": 2188720285,
          "created": "2025-09-19T21:33:55.803961Z",
          "modified": "2025-09-19T21:33:55.803978Z"
        }
      },
      {
        "source": "dandi",
        "asset_id": "sub-HO3/sub-HO3_ses-20250916T190930_obj-2sqh9d.nwb",
        "path": "sub-HO3/sub-HO3_ses-20250916T190930_obj-2sqh9d.nwb",
        "size_bytes": 14691680,
        "format": "nwb",
        "modality": null,
        "license": null,
        "source_url": "https://api.dandiarchive.org/api/dandisets/001603/versions/draft/assets/sub-HO3/sub-HO3_ses-20250916T190930_obj-2sqh9d.nwb/",
        "content_url": null,
        "checksum": null,
        "modified_at": "2025-09-19T21:34:00.052280Z",
        "raw_metadata": {
          "asset_id": "939e0920-8b09-449c-84f9-a54f512a1d47",
          "blob": "67294459-ec95-4f76-baec-3160808ad08c",
          "zarr": null,
          "path": "sub-HO3/sub-HO3_ses-20250916T190930_obj-2sqh9d.nwb",
          "size": 14691680,
          "created": "2025-09-19T21:34:00.052263Z",